1860-09-21.txt, ﻿21 сентября. Среда 1860 года. Долго я не писал в этой тетради. Наконец и соскучился. Отчего же и не написать чего-нибудь? Сегодня у меня был самый несчастный день. Пришли только в гимназию сейчас же вызвал Стоюнин, но я ему такой благовидный предлог представил, что он ничего не ответил. Потому Буш. Тут уж не посчастливилось. Вы Чемезов сегодня не приготовили сказал. Ну я и сел. Все таки думаю единицы не поставит. А поставит а потом узнаю что я получил 1 ½ не много же больше единицы. Лишь бы не отметил в билете а то начнутся расспросы так они для меня хуже всего. За Бушем Лемониус. Я сказал, что я не был в Субботу. Он отвечал, что надеется, что я в следующий раз лучше отвечу. Завтра хочу просить у Стоюнина позволения книги брать из казенной библиотеки. Да даст ли еще? Скажет чтобы кто-нибудь поручился. А кто из наших поручится? Никто. Тогда я и останусь с носом. А хорошо б было если б достал книгу а то выучишь уроки и не знаешь что делать так только валандаешься. Да и притом я многих сочинителей и не читал. Недавно мне случилось прочесть Обломова соч. Гончарова. Отлично написано. Всего лучше сам Обломов. Читаешь и сам переносишься в те места. Чудно было тогда не то что теперь. Что такое теперь. Отовсюду гонят. Бедных умножают, а все под предлогом улучшения разных глупых. Досадно слушать. Прежде умей только писать так тысячи наживешь а теперь и рубля то никак не добудешь. А все от чего? От того что царской то фамилии все прибавляется. А что нам в ней толку. Каждому на содержание нужно по 100.000 да при самом рождении кладется 500.000. А чиновников бедных гонят. Тошно становится когда вспоминаешь об этом. Какой источник найдешь себе для пропитания? Никакого решительно никакого. Сунься теперь с просьбою куда-нибудь так тебя так турнут что рад будешь убраться то по добру да поздорову. Скучно бывает иногда так скучно что не знаешь, за что приняться. Хоть бы найти учеников. Да нажить деньги собственные своим трудом. Да где теперь найти? Нигде не найдешь. Разве будешь ходить по улицам да кричать не надо ли учителя? Так тогда чего доброго пожалуй в трубную посадят да и сиди там, кисни. Иногда так защемит сердце что плакать захочется и не с кем поделиться тоской. А сердце между тем все ноет да ноет еще заиграют какую-нибудь жальную этакую пьесу. Молиться захочется. Негде молиться. Везде ходят. А и я бы хотел молиться один чтобы излить Богу всю свою душу. Наконец я решился писать и с этих пор буду исполнять это каждый день и каждый день продолжать мои записки. Детство, детство дай им всякого счастья и благоденствия. Счастья не земного но небесного. Много мама сделала для нас но мы отвечали им одною грубостью. Господи дай случай доказать как я люблю маму. Однако на этом день довольно я уже что-то много заговорился., , 
1860-09-23.txt, ﻿23 сентября. Пятница. Кедров говорят назначен преподавателем к детям Константина Николаевича. Видно он известен стал если его так возвысили. Не всякому то так посчастливится. А он вероятно умная башка потому что ведь секретарь совета а туда не назначат какую-нибудь пигалицу вроде Оттена. А жалко будет если он от нас выйдет. Впрочем не думаю. Сегодня он меня вызывал и посадил за то что я не знал одного слова. Странный он человек. Иногда множество ему наврешь он ничего. Другой раз за одно слово раскричится: Немыслящая физиономия, говорит, я вам загвозжу и посадит. Он очень вспыльчив но отличный учитель. Только ругается страшно. Никто из учителей так не бранится как он. Игнатьев вышел в 8ю гимназию. Вот тоже странный человек. Никак не разберешь какой у него характер. Добр ли он, зол ли кто его знает. Пришли сказать что дядя умер — он засмеялся. А если у него попросишь никогда не откажет всегда даст. В классе хладнокровен как рыба. Ничто на него не производит впечатления только кончики пальцев нюхает. Странный человек да и только. Сегодня на меня напала какая-то лень. Вот право — придутся же такие дни когда не хочется учиться. Ведь кажется немаленький да и не дурак понимаешь что учитель вызовет и единицу поставит, а все таки лень берет верх и бросаешь книгу. Видно уд такая у меня проклятая натура. Ничем не могу я заниматься в особенности. Хотел заниматься сначала Латинским языком до отдумал. Теперь хочу Греческим, а еще и не начинал. Есть же такие счастливые люди которые умеют себя принудить. А я что? Ведь я такой же человек, а не могу. Значит силы воли нет. А хотелось бы мне заняться. Ну что я выйду из гимназии? Был в Филологической гимназии воспитывался 7 лет. Кажется должен бы был знать языки хорошо, а на самом деле ничего не знаю. Какая же польза была что я находился именно в филологической гимназии а не в какой другой? Решительно никакой. Это досадно. Желал бы я воротить прежние годы да уж поздно. Так будет и в старости. Раскаюсь я что не учился. Имел все способы к образованию и ничего не делал. Совесть будет тогда грызть мое сердце. Лучше исправиться поздно чем никогда. Начну-ка я заниматься Греческим и Латинским да и дело с концом. Тогда бы уже Кедров не посадил меня по сегодняшнему да и между товарищами был бы почет. Всякий бы просил: переведи мне то, переведи другое. Да вот в чем главное то препятствие. Воли нет да и терпенья на достанет. А лучше всего молиться Богу. Он поможет лучше всякой воли и терпенья. Папа вчера уехал в Грузино. И как нарочно пошли дожди. Прежде не было а теперь начались. Видно уж зима скоро наступит. Ветер сегодня такой был сильный что просто ужас. Я только как вышел за ворота так я удержал едва фуражку да шинель, как ветер дунул. Вот славно написал что иной и не поймет. Приберутся же слова такие что их никак не поймешь., , 
1860-09-25.txt, ﻿23 сентября. Пятница. Кедров говорят назначен преподавателем к детям Константина Николаевича. Видно он известен стал если его так возвысили. Не всякому то так посчастливится. А он вероятно умная башка потому что ведь секретарь совета а туда не назначат какую-нибудь пигалицу вроде Оттена. А жалко будет если он от нас выйдет. Впрочем не думаю. Сегодня он меня вызывал и посадил за то что я не знал одного слова. Странный он человек. Иногда множество ему наврешь он ничего. Другой раз за одно слово раскричится: Немыслящая физиономия, говорит, я вам загвозжу и посадит. Он очень вспыльчив но отличный учитель. Только ругается страшно. Никто из учителей так не бранится как он. Игнатьев вышел в 8ю гимназию. Вот тоже странный человек. Никак не разберешь какой у него характер. Добр ли он, зол ли кто его знает. Пришли сказать что дядя умер — он засмеялся. А если у него попросишь никогда не откажет всегда даст. В классе хладнокровен как рыба. Ничто на него не производит впечатления только кончики пальцев нюхает. Странный человек да и только. Сегодня на меня напала какая-то лень. Вот право — придутся же такие дни когда не хочется учиться. Ведь кажется немаленький да и не дурак понимаешь что учитель вызовет и единицу поставит, а все таки лень берет верх и бросаешь книгу. Видно уд такая у меня проклятая натура. Ничем не могу я заниматься в особенности. Хотел заниматься сначала Латинским языком до отдумал. Теперь хочу Греческим, а еще и не начинал. Есть же такие счастливые люди которые умеют себя принудить. А я что? Ведь я такой же человек, а не могу. Значит силы воли нет. А хотелось бы мне заняться. Ну что я выйду из гимназии? Был в Филологической гимназии воспитывался 7 лет. Кажется должен бы был знать языки хорошо, а на самом деле ничего не знаю. Какая же польза была что я находился именно в филологической гимназии а не в какой другой? Решительно никакой. Это досадно. Желал бы я воротить прежние годы да уж поздно. Так будет и в старости. Раскаюсь я что не учился. Имел все способы к образованию и ничего не делал. Совесть будет тогда грызть мое сердце. Лучше исправиться поздно чем никогда. Начну-ка я заниматься Греческим и Латинским да и дело с концом. Тогда бы уже Кедров не посадил меня по сегодняшнему да и между товарищами был бы почет. Всякий бы просил: переведи мне то, переведи другое. Да вот в чем главное то препятствие. Воли нет да и терпенья на достанет. А лучше всего молиться Богу. Он поможет лучше всякой воли и терпенья. Папа вчера уехал в Грузино. И как нарочно пошли дожди. Прежде не было а теперь начались. Видно уж зима скоро наступит. Ветер сегодня такой был сильный что просто ужас. Я только как вышел за ворота так я удержал едва фуражку да шинель, как ветер дунул. Вот славно написал что иной и не поймет. Приберутся же слова такие что их никак не поймешь., , 
1860-09-26.txt, ﻿26 сентября. Понедельник. Странно право какое сильное влияние имеет погода на здоровье человека. Когда погода хороша самому как то весело и легко, все идет так приятно. Но когда либо пасмурно, грязь, снег как будто нехотя понемногу валится с неба, когда все бегут с улицы домой, тогда то вот самое главное состояние. Ничего не хочется делать, все не по-твоему, все гадко. Вот сегодня самый гадкий день. Все решительно так, как я сейчас описал. Сегодня я отнес на почту письмо к папе, в котором мама извещает его о воровстве. Из почтового отделения я прямо отправился к обедне. От обедни домой пить кофе. Вот и все, что я сделал сегодня. Есть ли из этого что-нибудь путное? То, что к обедне ходил. Как бы не так. Правда, если бы за обедней молился с усердием, это было бы хорошее дело, а если я глядел по сторонам. Это один только грех. А сколько бы добра мог я сделать в это время, сколько приобрести полезного и для себя и для других? Все прошло даром, все пропало. Есть же право такие счастливые люди, которые каждую минуту занятости, каждую минуту трудятся на пользу ближних. Ведь и я мог бы быть таким? Да, мог бы, если б захотел. Да у меня не станет воли, не станет ума, терпения, веры, если б я и захотел то быть таким. Что если у меня вся жизнь пройдет так, что я не сделаю ничего полезного ни для себя, ни для других. Ну да лучше замолчать. А то чем больше думаешь, тем чернее мысли приходят. Наконец придешь в такой азарт, что и тетрадь пожалуй разорвать. А лучшее средство против этого молитва. Молился бы я, много б молился, если б только было место, куда бы я мог укрыться один, чтобы никто не видал, не слыхал меня. А этого никогда не будет. Вчера Маша привела какую-то несчастную голодающую собаку с бельмами на обоих глазах. Одним глазом она совсем не видит, а другим немного только. Ну, конечно ее накормили сейчас, и оставили ночевать, а сегодня утром начали думать как бы ее прогнать. Выпустили на двор. Собака конечно не дура, где ее накормили, уж оттуда она не уйдет. Послали Катерину, чтоб ее прогнала. Та давай ее колотить. Собака пищит на весь двор и наконец убежала за ворота. Вот не знаю, что дальше будет. Удивляюсь я этим людям, которые не будучи в состоянии кормить собаку, имея на руках двух собак, зовут еще третью, для того только, чтоб ее накормить, оставить ночевать, а на другое утро приняться гнать, да еще колотить. Уж тут не пользу сделаешь собаке, а вред. По-моему, уж если брать собаку, так взять с тем, чтобы она и осталась жить. А то что за расчет, призвать собаку, накормить, а потом гнать и что та нейдет, так колотить ее. Вон Азорка. Тоже призвала его Маша, а не кто другой. Он у нас и жил и хворал и деньги тратили на его леченье а потом сам же он убежал и все пропало даром. Полкан опять, тоже Маша его привела и тоже он убежал. Уж кажется должна бы быть приучена, нет так призвала третью собаку, да еще умнее сделала, начала сама же ее гнать. Да и хоть бы приводила хорошеньких, а то все уроды какие-то являются. Все с бельмами, слепые, кривоногие, дураки. Ну да довольно уже. А то тошно становится, когда вспомнишь глаза с бельмами. , Вечером того же дня. Мама сейчас столько кончили варить варенье. Я им помогал и так наелся яблок и варенья, что даже тошно стало. Не знаю, мне что-то сегодня так скучно и от чего это? Вероятно я завтра единицу получу, от кого-нибудь. Собаки все еще нету. Дай Бог, чтобы не пришла. Скорей бы папа приезжали да укротили эту свинью кухарку Таубе. Она не давала дворнику запирать чердак, и говорила, что Таубе сам хочет купить замок и держать его у себя. Глупо право. Лень писать что-то. Тут говорят. Катерина стелет постели. Соня плачет. Костя лежит на диване. Никто ничего не делает и самому лень становится. Ну да пора спать. Скоро постели готовы будут, а завтра вставать рано., 
