1861-07-25.txt, ﻿25 июля. Вторник. После завтра будет месяц как я живу здесь т.е. в Грузино. До Субботы 1го июля мы жили т.е. я один жил у Каташеньки. В Субботу приехали из Петербурга мама, Маша, Котя, Катерина, Николашка, Лерка, Алешка и некоторые из необходимых вещей. Мы наняли молочный домик за 35 рублей серебром. Я в это лето многому научился: стрелять, играть в шахматы, грести веслами, править рулем и даже немного держаться на воде. Потом заниматься Саллюстием, но Костя не привез его. Теперь я хочу по возможности отовсюду собирать сведения о Графе Аракчееве, чтобы потом подать Стоюнину или просто его писать для себя два сочинения. Предметом первого будет рассмотрение характера Аракчеева, второго описание важнейших фактов его жизни. Сколько я могу судить о нем по отзывам одного старика по имени Ивана Васильевича, жившего еще при нем, а потом и некоторых писателей, как например Искандера, Пушкина, Дашковой, то можно сказать, что он был нехороший человек. Иван мне рассказал, как Алексей Андреевич наказал его во время холеры, погубившей множество людей. Во времена графа на месте нынешнего корпуса был лазарет, а месте лазарета конюшни. Каждый день умирало по нескольку человек, которые до погребения ставились в лазаретный склеп, освещаемый брезжившимся светом лампады. Таким образом накопилось однажды двенадцать покойников. В это время Иван в чем-то провинился. Аракчеев рассердился и засадил его на целую ночь к покойникам, да еще велел нумеровать кровати у голов мертвецов. Можете судить каково было бедному Ивану Васильевичу провести такую приятную ночь, а он еще был любимцем графа. Поэтому можно судить, как он наказывал других. Которых не любил. После этого рассказа старик прибавил: Крутенек был батюшка Алексей Андреевич. Искандер говорит, что Аракчеев был самое гнусное лицо, выплывшее после Петра I на вершины русского правительства. Пушкин отзывается об нем, как о холопе венчанного солдата. Княгиня Дашкова в своих записках, запрещённых в России, называет его самым преданным исполнителем тирании Павла. Когда во время Таганрогской поездки Александра здесь была убита поваром любовница Аракчеева, солдатка, его крестьянка, Анастасья, он тотчас бросил все государственные дела, прискакал сюда и не находя виноватых тотчас написал об этом к Новгородскому губернатору записку которая еще до сих пор хранится в золотом ковчеге в тамашнем правлении. В этом письме граф просил как можно скорее разыскать преступника. С тех пор пошли ужаснейшие пытки. Достаточно было только одного неосторожного слова, одного пустого подозрения, что бы подвергнуться ужаснейшим мучениям. Наконец добрались таки до виновного и он был, конечно, приговорен к кнуту. Но в это время вошел на престол Николай и по его приказанию все производители суда быть сами отданы под суд и сосланы в Сибирь. Вот каков был Аракчеев Когда он впервые вошел в связи с Настасьей у нее еще был жив ее муж, солдат. Желая от него избавиться этот изверг велел утопить его и вот однажды в темную ночь, когда ничего не подозревавший солдат спокойно переезжал на пароме через Волхов, на самой середине он был брошен в реку и погиб в волнах ее. До сих пор еще на берегу Волхова, противоположном Грузину, существует одноэтажный дом, выкрашенный желтой краской. В нем всегда можно быть видеть чаны с горячей водой, в которой прели гибкие прутья, назначенные для наказания виновных и не проходило одного дня, чтобы не было экзекуции. А за что их драли? За то, что проходящие барки иногда касались Аракчеевских яликов, стоявших у Грузино. А Настасью погребли в соборе здешнем во имя Андрея Первозванного и по приказанию Аракчеева не закрывали склепа, где был поставлен ее гроб. В продолжении целого года, каждый день Аракчеев ходил плакать на ее гроб и по смерти был похоронен рядом с нею. На крыше его дворца был устроен бельведер, в котором стояла зрительная трубка. Деревья в саду подстригались так, что граф мог обозревать все поля и посредством трубки наблюдать, как кто работает. В Субботу каждой недели он сзывал крестьян и хорошо работавших угощал рюмкой водки, а ленившихся розгами. На сегодняшний день довольно. Завтра я разузнаю побольше и запишу. Сейчас приходил Владимир Васильевич, брат Дарьи Васильевны, здешней попадьи. Я, напившись кофе, пойду ловить рыбу., Вечер того же дня., 
1861-07-26.txt, ﻿26 июля. Среда. Вчера после завтрака я отправился ловить рыбу. Долго стояли мы на ванне и ничего не поймали. Вскоре пошел дождик и мы, желая от него скрыться, вошли в ванну. Тут Кронит Иванович прочел наизусть Полтаву Пушкина. По окончании дождика мы выкупались. Танцевали в воде tramblent, играли в пятнашки. Я уже начинаю немного плавать. Потом мы пошли на плот, куда пристает пароход. Там рыба тоже нисколько не клевала. Мы уже наскучились и под конец решились попробовать половить с барок. Котя лег в копне сена, а мы закинули удочки. Рыба начала беспрестанно браться. Только таскай и все густера большая. В короткое время у меня на веревке очутилось 50 штук. Вдруг у меня повело поплавок. Я весь впился в него глазами. Начало немножко его подергивать и вдруг он исчез под водою. Я подсек. Что-то тяжелое тащилось на крючке. Я все продолжал выше и выше поднимать удочку. Из воды показалась голова большой рыбы. Я осторожно вытащил его на барку, где Костя снял с крючка и насадил на веревку. Это был язь в ¾ фунта. Первый раз в жизни я поймал такую рыбу. Вчера приезжал к нам дяденька Петр Николаевич. Сегодня все идет, Вечер того же дня., 
1861-08-10.txt, ﻿10 августа. Четверг. Петербург. Вчера я приехал в Петербург. Вчера я встал в 8 часов утра. Погода была превосходная. Я простился со всеми и сопровождаемый ими отправился на пароход. Долго мы ждали его. Наконец увидели и пошли на плот., Вечер того же дня., 
1861-08-11.txt, ﻿11 августа. Пятница. Я взошел на пароход и когда он отчалил, долго еще кивал нашим. Наконец, увидев, что они пошли с плота, я взял билет в III класс и смиренно сел на палубу. В то время, как мы подъезжали к пристани, машина из Москвы переходила мост. Я с парохода пошел на галерею и, попросив одного унтер-офицера присмотреть за вещами, взял билет в вагон. В 12 часов машина тронулась. Небо было чистое и ясное. Солнце светило весело. Совсем не было похоже на осень. Чем ближе стали мы подъезжать к Петербургу, там пасмурнее становилось небо. Когда машина поехала от Колпина начал моросить дождик. Приехав в 6 часов в Петербург, я нанял извозчика. Папа был дома. Я, поздоровавшись с ним и поговорив немного, отправился, по поручению мамы к Шипулинскому намереваясь от него зайти к Рибо. Подхожу к одному дому, вижу написано Дом жены доктора Шипулинского. Я вошел в калитку. Она не была заперта. На дворе никого не было. На лево и на право дверь. Я пошел на лево и вошел в кухню. Там ни души. Посуда стоит на плите. Обворуй, так никто и не остановит. Подождав немного, не выйдет ли кто, я отправился в дверь на право. Вхожу в прихожую и там никого нет. Что за пропасть? Петербург не деревня. Никого нет, так сейчас и обворуют. Нечего делать должен был идти назад ни с чем. Прихожу к Рибо. Говорят: Дома нет ушел в Таврический. С горя я пошел в гимназию узнать, начались ли классы. Там теперь идет крашенье да переделывания такие, что чудо. Там было вывешено объявление, что классы начнутся 16 августа, в Среду. Вчера я с папой пошел в Петровского острова сад ловить рыбу, но не поймав ничего, должны были воротиться назад. Вечером зашел Рибо. Сегодня я встал в 7 часов и написал к машине письмо в Грузино. Погода что-то пасмурная. То проглянет солнышко, то пойдет дождь, то ни дождь, ни солнце, а просто тучи заволокут небо. Ненавижу я такой погоды. По-моему уж если идти дождю, так пусть он и идет целый день, если нет, так пусть будет хорошая погода во весь день. А то что такая перемена., Вечер того же дня., 
1861-08-12.txt, ﻿12 августа. Суббота. Вчера у нас обедал Николай Александрович. Во время обеда вдруг кто-то сильно звонит. Папа думал, что Петр Николаевич, а это была Настасья Петровна. Она посмотрела постройки и сказала, что едет в деревню с Марьей Павловной на 12 дней. Вместе с тем звала меня в Царское делать там какую-то иллюминацию. Дяденька ушел от нас в десятом часу вечера. Сегодня день пасмурный. Небо серое, покрыто тучами и морочит дождик. Должно быть теперь уже каждый день будут идти дожди. Осень наступает. Ужасная скука. Приехал сюда, чтоб заниматься Саллюстием, а ничего делать не хочется. Сейчас только окончил починку моей форменной амуниции, которая уж порядочно износилась. Зато я ношу ее уже третий год. Когда я был в Грузине, я не ценил тогда прогулок, особенно ночных, а теперь — с какой бы радостью полетел туда. Не забыть мне одной ночи с Воскресенья на Понедельник перед тем как надо было ехать Владимиру Васильевичу. Ночь была превосходная. Темно-синее почти черное небо было испещрено звездочками, различной величины, ярко блестевшими. Красавица луна щедро бросала свои зелено-серебряные лучи на все предметы. Я с Машей сидел на колоннаде перед собором. В саду было совершенно темно и тихо. Некоторые только из деревьев ужасно покачивались. Над болотом носился густой туман, серебристый от луны. И среди всей этой темнота, как огромное привидение подымался от земли белый каменный дворец и на нем ярко блестела надпись Аракчеева: Без лести предан. Все здание было облито мутным светом, резко отделяясь от окружавших его предметов. Памятник перед дворцом был также превосходен. На пьедестале из гранита была поставлена Вера, Надежда и Любовь, возлагавший блестящий золотой венец на главу Александра. У подножия в виде Русского воина, преклонившись на одной колено был изображен сам Аракчеев. С другой стороны в подобном же положении какая-то женщина, должно быть Настасья. Вся группа была вылита из темной бронзы потому не ярко была освещена. Зато венец, как золотой, блестел при луне., Вечер того же дня., 
1861-08-15.txt, ﻿15 августа. Вторник. В Воскресенье я сходил к обедне и потом целый день пролежал на диване, читая книги. Вчера папа ушел к Яковлевым покупать железо, а я остался дома. Папа воротился домой в пятом часу вечера. Отобедав, он лег спать, а я принялся читать. Вскоре пришел Рибо и мы с ним пошли в Таврический сад. Я первый раз был там. Этот сад гораздо лучше Летнего. По крайней мере есть прудки, на которых может отдохнуть взор, после вида Петербургских мостовых. Там я потерял свой перламутровый перочинный ножик, что мне очень неприятно, так как он для меня дорого стоил, именно 1 рубль 20 копек. Из Таврического я зашел к Рибо, взял у него почитать книг и пошел домой. Дома я застал архитектора и его племянника Соловьева. Они просидели до 11 часов вечера. Рибо просил меня переписать прошение. Что со мной сегодня сделалось, я и сам не понимаю. Грустно как-то скучно. Сердце бьется как будто я его боюсь. Самая погода способствует к такому состоянию. Небо все покрыто тучами. Серо, темно, а дождя нейдет. Что-то наши делают в Грузино. У нас еще продолжены каникулы до 21 августа. Вот если б я был в Грузине. Как бы там хорошо было. Вечер того же дня. Сегодня приехала Соня из Аринбурга. Мы ее ждали еще к 12 Августу, но сильный ветер замедлил прибытие парохода. Я написал просьбу Рибо, испортив предварительно пять листов хорошей бумаги. После обеда, в седьмом часу, я ее отнес к нему. Завтра мы хотим с Соней ехать в Грузино. Боюсь, чтобы не было нагоняя от мамы., Вечер того же дня., 
1861-08-29.txt, ﻿29 августа. Вторник. На другой день после описанного мною т.е. 16 августа в Середу я с Соней отправился в Грузино. Во всю дорогу моросил дождик, что было чрезвычайно неприятно особенно в вагонах. Хорошо, что я запасся книгою, которую всю и прочитал во время дороги. На Волховской станции с машины мы пересели на пароход и покатили вниз по батюшке по Волхову. Между тем стемнело и миллионом черных глаз глядела ночи темнота. Действительно ночь была такая, что хоть глаз выколи. Порою издали мы видели на Волхове огонь. Это был костерок, разложенный на лодке, варившими кашу. Вскоре мы подъехали к плоту. Темень ужаснейшая, особенно после Петербургского газового освещения. Если б я не знал Грузина, как свои пять пальцев, я бы право не нашел дороги к дому. Более всего я опасался того, что наши уехали в Петербург. Подходим к дому и видим свет в окне. Я обрадовался и постучал в дверь. Котя отворил ее. Тут начались расспросы. Мы были голодны и плотно поехали теперь. Котя показал чучело векши, которую он недавно убил. На другой день мы пошли ловить рыбу и в два часа 65 штук, довольно больших весивших 5 фунтов ¾ . Потом мы ходили на охоту за утками. Уток бездна летала, но садились посреди болота. Убить то можно было да некому достать и мы воротились домой, ни сделав ни одного выстрела. В Воскресенье я уехал в Петербург. Как меня поразил здешний грохот, шум, пыль, крик, громадные дома, которые кажется так и хотят тебя задавить и ни одного клочка свежей земли. Если и встречалась, то такая заморенная, запыленная, тощая, что лучше б ее и не было. Во Вторник приехали наши и потянулась наша обычная Петербургская жизнь, однообразная как столбовая дорога. Сегодня праздник усекновения главы Иоанна Предтечи, завтра именины Императора. А все как-то мысли невольно обращаются к Грузину. Если б на будущий год удалось мне прожить там лето. Ну да ничего еще об этом толковать. Когда дяденька Пётр Николаевич был в Грузине, он нам сообщил следующие стихи Рылеева:, В России чтут, 
1861-08-30.txt, ﻿30 августа. Среда. Сегодня именины Императора. Котя, Маша и Соня уехали на двухчасовой т.е. я вру, они пошли в 2 часа, а уехали то в 3 ½ в Павловск слушать музыку и смотреть фейерверк. Папа ушел на Неву к Невскому монастырю ловить рыбу. Дома осталась только мама, да я. Вот продолжение Гитары., В последней строчке надо читать не кружок, а клубок., 
1861-09-02.txt, ﻿2 сентября. Суббота. У нас новый попечитель генерал-адъютант Филиппсон. Пошла теперь военщина, так и рукой можно. Опять введется в употребление проклятая дисциплина, от которой мы хоть немножко поотвыкли при Делянове. Я взял у Стоюнина Лермонтова и хочу списать несколько стихотворений, чтоб выучиться со временем наизусть., Молитва, 
1861-09-08.txt, ﻿8 сентября. Пятница. Поелику сегодня праздник Рождества Богородицы, то я и не ходил в гимназию. День самый скверный. Самому холодно дрожишь. Ужас что такое, Молитва, 
