1860-11-14.txt, ﻿14 ноября. Понедельник. Вчера я был у Леонтьевых. Не хотелось мне идти туда да нечего делать отправился. Погода была не хорошая, не годная. Когда я пришел к ним у них были гости: Настасья Абрамовна Брентштейн и Настасья Петровна да еще Дмитрий Константинович, который приехал недели три тому назад. Потом к нам приехала какая-то дама с мальчиком. Я у них пробыл до вечера, получил 20 копеек и воротился домой. Сегодня все прошло благополучно. Не знаю что то завтра будет. Надо учиться хорошенько а между тем какая-то глупая лень находит. Хотел бы преодолеть ее, да силы нет. Так она вкоренилась. Это гадко. Надо вырвать это зелье с корнем вон. Но без посторонней силы нельзя этого сделать. Господи, Господи Ты наказуешь меня. Прости, прости Бедное животное до последней возможности служит им, а они что возьмут от кого-нибудь щенка. Кормят, кормят его, а когда он вырастет да захворает так и гонят. Не надо, дескать. Отчего право не устроить заведения, где бы принимали собак всяких и других животных. Если б я ворочал миллионами, непременно б сделал это. А то право жаль смотреть на бедных животных, самые преданные человек терпят это. Люди со всеми так делают. Пока животные молоды да могут пользу приносить им они держат их. А как состарятся так в благодарность его в три шеи со двора. А для того ли дан человеку разум чтоб он вредил другому? Для того ли ему дано превосходство над другими животными чтоб он употреблял его во зло? Ведь он такое же животное. А все это зачтется ему в последствии., У нас Е.А. останется ночевать. Мамы еще нету. Довольно одиноко и то хорошо., 
1860-11-22.txt, ﻿22 ноября. Вторник. В четверг будут Каташенкины именины. Вот то приготовления к нему идут Дай мне силы, если не теперь, то по крайней мере впоследствии заслужить это у папы. И какой я не благодарный. Как часто я грубил ему, выводил его из терпения, и за это-то я получаю вознаграждение. Сегодня приходил нянькин брат. Снял с меня мерку для сапог. Они будут готовы на будущей неделе и стоят 3 рублей 50 копеек. И это не шутка. Как нынче все стало дорого. В гимназии у нас распространилась болезнь свинка так, что в лазарете места нету. В Субботу вызывал меня Миквиц из Физики. Пришлось отвечать о сферических зеркалах. Я ему как знал так и рассказал. Одной теоремы я не припомнил и еще часть соврал. Вот мне по окончании класса и говорит мне: Вы, Чемезов, говорите довольно плавно, но с некоторыми задвижками какими-то. Значит вы не понимаете ничего, но вызубрили и вызубрили хорошо. Конечно мне не понравилась такая проповедь. Я и озлился немножко тут. Начал с ним спорить. Не беситься, не беситься говорил мне хлопая по моему плечу. Ну, наконец помирились и расстались хорошо. Он поставил тройку. Однако своими словами он показал свое сомнение в том что я понимаю то, что я говорю из физики или из математики, а не задалбливаю этого., У нас Е.А. останется ночевать. Мамы еще нету. Довольно одиноко и то хорошо., 
1860-11-25.txt, ﻿25 ноября. Пятница. Третьего дня в девятом часу приехала Каташенька с Иваном Галактионовичем и детьми. Вчера собрались гости: Елизавета Алексеевна, Георгиевские все и дяденька. Ну конечно была суматоха. Легли в 3м часу. Однако пора делом заниматься., У нас Е.А. останется ночевать. Мамы еще нету. Довольно одиноко и то хорошо., 
1860-12-04.txt, ﻿4 декабря (ноября).  Воскресенье. Я сегодня не ходил к Леонтьевым. Да и куда тут пойдешь. Такой мороз наступил, что просто ужас. Настоящий русский. У нас в гимназии основана Воскресная школа. Я положил себе за правило учиться к каждому дню изо всех предметов, что я прежде не делал. Начало хорошо. Вчера от Буша получил 4. Если бы каждый день по 4, так ничего б было ехидно., У нас Е.А. останется ночевать. Мамы еще нету. Довольно одиноко и то хорошо., 
1860-12-29.txt, ﻿29 декабря. Вторник. Отметки у меня самые плохие. Надо учиться хорошенько. Еще есть время поправиться. Буду стараться. От Лапшина я какими-то судьбами получил 5 и в тот же день от батюшки 5. Счастливый видно денек выбрался. Зато от Лебядинского 1, из физики 2 ½. Ужасно, Ужасно Лучше не писать. Я не знаю отчего Миквиц мне не поставил 3. Я ему знал. Такая тоска право когда вспомнишь про отметки, что я не знаю, куда деваться. Уже именно сердце кровью обливается. Ведь я могу лучше учиться, но ленюсь, не хочу. Надо преодолеть проклятую лень. Отбросить ее, но не могу, нет силы. Неужели я так слаб, что даже не могу хорошенько учиться? Человек может все сделать, что только он захочет. Сегодня у нас освистали Герсдорфа. В Субботу на прошедшей неделе мы были первый раз в Мариинском театре. Мне он не очень понравился. Так себе, ничего и хорошо в особенности газовое освещение. Играли Кроатку. Леонова была одета в мужское платье. Вот разыгралось то ретивое. Пели знаменитости — Васильев, Петров, Сетов, Булахова. Декорации хороши, впрочем не очень. Мне Большой театр больше нравится., У нас Е.А. останется ночевать. Мамы еще нету. Довольно одиноко и то хорошо., 
1861-02-03.txt, ﻿3 февраля. Пятница. Я списал в Рибо стихотворение латинское, которое хочу выучить:, Настоящая студенческая песня. Все, так и пахнет независимостью. Эти стихи очень годятся для нового года. Вот и другие. Вероятно я тут много наврал потому, что ничего не понимаю. Потом когда-нибудь переведу. Пускаясь в философские рассуждения о том, как бы мне хорошенько учиться, представляя себе золотые горы в будущем, воображая себя первым учеником, наверху теперешнего счастья, я нисколько не думал осуществить свой идеал, достигнуть моей цели. И я имел бы силу совершить это. Мне надо немного старания и я превзойду прочих. Но старания то, самого то нужного, прилежания у меня и не достается. Я такого характера, что за мной надо строго следить, всегда стоять наготове, с плеткой в руках и чуть только во мне заметили что-нибудь недоброе, сейчас только меня плеткой так чтоб я к потолку подскочил — тогда только я буду хорош, а если меня предоставить самому себе, мне т.е. дать совершенную волю — тогда беда — все кончено. Главное у меня нет воли. А надо учиться, надо учиться, и ни как-нибудь, а хорошо. Папа теперь беден, надо его поддерживать, надо утешить старика, хоть чем-нибудь, хоть раз в жизни доставить ему удовольствие, обрадовать его, что он мог сказать: Вот какие у меня дети Опять мечты, опять несбыточности, пустота. Да неужели я не могу достичь до такого счастья? А все кажется есть у меня. И покой, и книги, и способности, и тепло, и сытно, ни о чем не надо заботиться, как только о учении. И что же я делаю? Ничего, в полном смысле ничего. Грешно, грешно этак поступать. А есть семьи у которых и половины нет того, что у меня есть, а учатся отлично. Отчего же бы я не смог того же делать? Лень, лень проклятая одолевает меня, уничтожает, попирает меня Просто я не знаю, что делать. Этакие ведь минуту нашли, что просто не знаешь, куда деться. Ну да, довольно уж., 
1861-02-04.txt, ﻿4 января. Пятница. У меня что-то все время переменяется. Вчера был февраль, сегодня январь. Вчера Пятница, сегодня Пятница. А все от рассеянности. Костя что-то слишком с папой спорит, прекословит во всем. Грубит, чёрт знает что такое. Вспомнит потом он, покается, будет его совесть мучить за это но уже поздно тогда. И охота папе ухаживать за ним — я не понимаю. Я бы на их месте ругал бы его на каждом шагу, пришпорил бы так, что он не смел слова сказать. Досадно право смотреть его такое обращение, теперь, когда он им всем обязан. Что же будет тогда как они будут обязаны в чем-нибудь ему — да он заест их. Худо у нас что-то все. Не знаю отчего. Сегодня меня вызывал Буш. Сказал gut и поставил 4. Начало то хорошо. Да оно всегда так бывает, что начнет хорошо, а кончит худу. Теперь все поговаривают о крестьянском деле. Говорят, что в 19 февралю будет объявлено. Послужит ли это же пользе? Не знаю. Теперь и знать то нельзя, а то сейчас в крепость. Однако пора заняться и делом, а не болтать пустяки., Настоящая студенческая песня. Все, так и пахнет независимостью. Эти стихи очень годятся для нового года. Вот и другие. Вероятно я тут много наврал потому, что ничего не понимаю. Потом когда-нибудь переведу. Пускаясь в философские рассуждения о том, как бы мне хорошенько учиться, представляя себе золотые горы в будущем, воображая себя первым учеником, наверху теперешнего счастья, я нисколько не думал осуществить свой идеал, достигнуть моей цели. И я имел бы силу совершить это. Мне надо немного старания и я превзойду прочих. Но старания то, самого то нужного, прилежания у меня и не достается. Я такого характера, что за мной надо строго следить, всегда стоять наготове, с плеткой в руках и чуть только во мне заметили что-нибудь недоброе, сейчас только меня плеткой так чтоб я к потолку подскочил — тогда только я буду хорош, а если меня предоставить самому себе, мне т.е. дать совершенную волю — тогда беда — все кончено. Главное у меня нет воли. А надо учиться, надо учиться, и ни как-нибудь, а хорошо. Папа теперь беден, надо его поддерживать, надо утешить старика, хоть чем-нибудь, хоть раз в жизни доставить ему удовольствие, обрадовать его, что он мог сказать: Вот какие у меня дети Опять мечты, опять несбыточности, пустота. Да неужели я не могу достичь до такого счастья? А все кажется есть у меня. И покой, и книги, и способности, и тепло, и сытно, ни о чем не надо заботиться, как только о учении. И что же я делаю? Ничего, в полном смысле ничего. Грешно, грешно этак поступать. А есть семьи у которых и половины нет того, что у меня есть, а учатся отлично. Отчего же бы я не смог того же делать? Лень, лень проклятая одолевает меня, уничтожает, попирает меня Просто я не знаю, что делать. Этакие ведь минуту нашли, что просто не знаешь, куда деться. Ну да, довольно уж., 
1861-02-18.txt, ﻿18 февраля. Суббота. Февраля. Все что-то поговаривают об воле. Разные слухи, будто бы объявят волю 19го в Воскресенье, но Генерал-губернатор не замедлил публиковать, что все это пустяки. Однако, не смотря на то, что все это пустяки идут видимые и не мало важные приготовления. Так например говорят, что в крепость перевезены все годные оружия из арсенала, который находится на Литейной, что там заряжена цела батарея, что туда переведут Преображенский полк. Но ведь всего не перескажешь, что говорят. В Полицейских Ведомостях публиковали, будто бы в Варшаве был бунт. Дело вот в чем: 13-го прошедшего февраля Поляки захотели править тризну по убитым в сражении при Грохове. Вскоре составилась процессия. Сошлось много народу. Но войска как скоро увидели это, тотчас разогнали всю торжественную процессию. Дело этим не кончилось. На другой день 5 000 народа собралось на главной площади. Войска то же явились туда. Но их не пускали. Начали бросать камнями, бить, толкать. Отдан был приказ роте дать один залп из ружей по толпе, почему и были убиты 6 человек, да 6 ранены. Но ведь в газете написано, а почему знать может быть в Варшаве 20 человек убито, да столько же ранено. Потом сегодня утром часу в 3м один пьяный мужик закричал на улице: Воля, ребята, воля. Его тотчас схватили. Созвали всех дворников. Ввалили мужику 200 розог, а дворникам объявили, чтоб они при первом подобном случае доносили полиции, а в противном же случае с ними будет поступлено как с виновными. Говорят, что дворяне весьма недовольны императором и в прошедшем заседании его встретили молча, так, что почти он один все решил. Отдал приказ, чтоб помещикам давать помощь, по первому их востребованию., Настоящая студенческая песня. Все, так и пахнет независимостью. Эти стихи очень годятся для нового года. Вот и другие. Вероятно я тут много наврал потому, что ничего не понимаю. Потом когда-нибудь переведу. Пускаясь в философские рассуждения о том, как бы мне хорошенько учиться, представляя себе золотые горы в будущем, воображая себя первым учеником, наверху теперешнего счастья, я нисколько не думал осуществить свой идеал, достигнуть моей цели. И я имел бы силу совершить это. Мне надо немного старания и я превзойду прочих. Но старания то, самого то нужного, прилежания у меня и не достается. Я такого характера, что за мной надо строго следить, всегда стоять наготове, с плеткой в руках и чуть только во мне заметили что-нибудь недоброе, сейчас только меня плеткой так чтоб я к потолку подскочил — тогда только я буду хорош, а если меня предоставить самому себе, мне т.е. дать совершенную волю — тогда беда — все кончено. Главное у меня нет воли. А надо учиться, надо учиться, и ни как-нибудь, а хорошо. Папа теперь беден, надо его поддерживать, надо утешить старика, хоть чем-нибудь, хоть раз в жизни доставить ему удовольствие, обрадовать его, что он мог сказать: Вот какие у меня дети Опять мечты, опять несбыточности, пустота. Да неужели я не могу достичь до такого счастья? А все кажется есть у меня. И покой, и книги, и способности, и тепло, и сытно, ни о чем не надо заботиться, как только о учении. И что же я делаю? Ничего, в полном смысле ничего. Грешно, грешно этак поступать. А есть семьи у которых и половины нет того, что у меня есть, а учатся отлично. Отчего же бы я не смог того же делать? Лень, лень проклятая одолевает меня, уничтожает, попирает меня Просто я не знаю, что делать. Этакие ведь минуту нашли, что просто не знаешь, куда деться. Ну да, довольно уж., 
