1862-01-27.txt, ﻿27 января. Суббота. Сегодня Лемониус читал нам бумагу, от попечителя или министра не знаю, в которой дозволяется воспитанникам VI и VII классов посещать Публичную библиотеку, только не всем, а тем, у которых менее 3., ни в одном предмете нет. Кроме того желающий посещать библиотеку должен у педагогического совета испросить бумагу на дозволение этого. Ходить в библиотеку не иначе, как в форменном, застегнутом на все пуговицы, платье. Сделали доброе дело, нет таки не утерпели; ограничили число посещающих библиотеку. Сегодня вызывал меня Буш и сказал güt. Вызывал Миквиц — и ничего не сказал потому, что я ему отказался., Сын отечества 1862 г. №1. Января 1го., 
1862-01-30.txt, ﻿30 января. Вторник. Сегодня вызывал меня Миквиц из физики. Пришлось отвечать о равновесии сил в наклонной плоскости если одна из них действует параллельно основанию плоскости о равновесие винта. Сошло хорошо. Вызывал еще батька. Я ему кое-как ответил. К завтрему по своему обыкновению никому не знаю, исключая Лапшина да Струве, которого мы прозвали Негропонтовым. Право странно. Ни одного на неделе нет, к которому бы я все уроки приготовил. Непременно двух не знаю. Уже это редкость если один не выучился. А отчего все это? Частью от лени, а частью в том виновато и само начальство гимназии. Ведь это легко подумать 5 уроков в день с 9 часов утра до 2 ½ пополудни и все обязательные. Утром сидим в гимназии, вечером придем домой — тоже долби. Ведь это ужасно Станешь наконец и лениться. И предметы то все в каком-то неустойчивом равновесии. Чуть из одного больше занялся — другой не будешь знать. И всякий преподаватель требует, чтобы ему отвечали. Пора бы кажется обратить на это внимание. Уменьшить такое разнообразие предметов в один день, а то иногда бывает такой хаос в голове, что сами ничего не понимаем. Пишем немецкие слова вместо греческих и подобную чепуху., Сын отечества 1862 г. №1. Января 1го., 
1862-02-01.txt, ﻿1 февраля. Четверг. Я сделался вором. Украл галоши, потому что мои украли и хочу утаить несколько лучших чертежей из атласа к анатомии Жемчужина. За это меня Бог и наказывает. Кроме галош у меня пропала Физика. Несчастье и только. Сегодня меня вызывал Беллярминов и поставил в месячных 5. Из гимназии ушел я раньше, чтобы украсть галоши получше, а маменьке сказать, что Лемониуса нет. Вчера мы были у Блеха танцевали. Никак я не могу танцевать польку и мазурку польку. Как то все не выходит. Попробовал было вчера с сестрой Блеха Юлией Николаевной, да соврал. Сегодня тоже надо к нему идти., Сын отечества 1862 г. №1. Января 1го., 
1862-02-15.txt, ﻿15 февраля. Четверг. Вчера мы были у Блеха. Особенного ничего не было. Мы отпущены до 20 февраля, вторника будущей недели. Есть время погулять. Третьего дня я ходил в Мариинский театр, хотел взять билет на сегодняшний день, да не давали, рано пришел. Сегодня я опять ходил. Завтра вечером будут играть Жизнь за царя. Билета ни одного уже не было, когда я пришел и, не желая воротиться домой с пустыми руками я взял билет на утренний спектакль. Дают Deborah. Котя с Машей уехали в Грузино. У нас теперь Петр Николаевич и Александрович Николай. Я купил немецкий словарь. Надо заняться немецким языком. На каникулы хочу остаться здесь, купить немецкий учебник Оллендорфа и заниматься вместе с Рибо. В Понедельник был у на именинах, выкурил две папироски, отчего меня вырвало. Кажется ничего нового больше нет., Сын отечества 1862 г. №1. Января 1го., 
1862-02-19.txt, ﻿19 февраля. Вторник. В Пятницу я был в Мариинском театре. Пернини играет превосходно в роли Деборы. Она еще девица. По крайней мере в афише Fräulein Pernini. Из других актеров хорошо играли  в роли , потом , ее дочка, потом. Про и говорить нечего. Она всегда превосходно играет. Вся пьеса состоит в том, что, сын судьи, влюбился в жидовку Дебору и хочет на ней жениться, но отец и его друзья отговаривают от этого, который ни на что не соглашается. Наконец решились испытать Debor’у именно послать ей денег. К несчастию вместо Debor’ы деньги взяла другая жидовка. Отлично представила жидовку как она с жадностью бросается к деньгам, прижимает их к груди, прячет, прыгает, хохочет. Такой поступок мнимой Деборы обескураживает и он решается жениться на. Дебора узнает это и клянется местью. Потому действие переносится в Иерусалим. Здесь Debora разговаривает с одним жидом и открывает ему свое намерение ехать для исполнения задуманной ею мести к. Несмотря на все увещания Еврея она отправляется и приходит в дом во время его отсутствия. Жена не узнает Деборы, дает ей пить, усаживает. Debora вскоре уходит. В это время приезжает. Потому Деборы возвращается, находит дочь, целует, ласкает ее и спрашивает знает ли кто она такая. Девочка называет ее Деборою. Это обезоруживает Еврейку, она прощает и вручает его дочери свое ожерелье. Выходит. Дочь подает ему подарок Деборы.  Узнает. Бросается на колена и несколько раз зовет: Deborah Это легко рассказать, но не легко сыграть. Особенно трогательно было изумление Деборы, когда она услышала свое имя в устах дочери. В Воскресенье я был тоже в Мариинском на утреннем спектакле. Давали Чужое добро впрок нейдет. Особенно отличались Васильев 2 и Ланская. Дело состоит в том, что сын содержателя постоялого двора нашел на большой дороге деньги и начал кутить. Отец ему не все деньги отдал, а советовал удерживаться от кутежа, чтоб другие не узнали, что у них есть деньги. Сын познакомился с камердинером помещика (Шеман), который присоветовал ему убить отца и взять деньги, но их схватывает. Сын просит прощения. Отец дает. Этим и кончается. Об остальном поговорим в другой раз. Да я очень и об этом то кратко рассказал; надо было поподробнее, да лень стало. Завтра надобно в гимназию идти, так не хочется очень то разглагольствовать., Сын отечества 1862 г. №1. Января 1го., 
1862-03-27.txt, ﻿27 марта. Вторник. Пять недель великого поста прошли, как будто их и не было. Поговаривают об экзаменах. Лемониус дал нам самим сделать их распределение и мы на каждый экзамен дали несколько дней приготовления. Страшно, да что делать без экзамена не отпустят. Надо постараться. Я встаю в седьмом часу и весь день занимаюсь., Сын отечества 1862 г. №1. Января 1го., 
1862-03-28.txt, ﻿28 марта. Среда. В виду экзаменов на меня напала ужасная лень, свергнуть которую не хватает сил. Вот тут то и оказывается мелочь характера. Мечтаешь, что будешь заниматься минутки не будет свободной. А выходит наоборот, нет минуты занятой. Надо себя приучить, что если поставил что, так и исполнять это, не отступая ни на шаг. Я так побаиваюсь экзаменов. Особенно страшно для меня: История, немецкий и французский язык, такие предметы незнание которых трудно теперь исправить. Надо было заниматься с начала года. А теперь уже поздно. Нет уж видно во всяком русском человеке есть какая-то лень и особенное влечение все делать на авось. С чином то и аттестатом пожалуй я выйду, да мне не хочется быть ниже Потолова, что непременно будет. Ф. говорит, что директор посылает на монетный двор за второй золотой медалью. Таким образом у нас будет четыре медали. Если выйду четвертым получу медаль. Де Ф-то трудно с места. Впрочем я буду заниматься, как могу. Получу медаль хорошо, а нет так и выйду не ниже П., чего мы мне очень хотелось. Говорят, что у нас экзамены будут вечером, чтобы не отрывать учителей от дневных занятий. Батюшка вчера сказал нам несколько слов, в которых благодарил за хорошее поведение и занятия но вместе с тем просил хорошенько приготовляться к экзамену, потому что он намерен пригласить ректора семинарии или академии., Сын отечества 1862 г. №1. Января 1го., 
1862-03-30.txt, ﻿30 марта. Пятница. Сегодня в 2 ¼ часа нас отпустили готовиться на экзамены. Теперь все зависит от одного меня, а я еще ничего не начинал делать. Вчера к нам приехала Каташенька с детьми. Она кажется намерена остаться до Вторника. Пусть бы скорей уезжала, а то ничего не приготовится. Стоюнин будет продолжать свои лекции. Однако пора заниматься., Сын отечества 1862 г. №1. Января 1го., 
1862-04-04.txt, ﻿4 апреля. Среда. Пятый день пришел с тех пор как нас отпустили, а я повторил только половину арифметики. Мне кажется, что ко 2му Мая я кроме математики не повторю ничего другого. Это будет худо. Надо торопиться. Сегодня я исповедовался, да успел столько нагрешить, что хоть сейчас идти снова исповедоваться. Завтра день моего рождения и причастия. Завтра минет мне 17 лет. Довольно, чтобы сделать что-нибудь полезное, научиться хоть чему-нибудь, а как посмотришь так выходит, что ничего не сделано хорошего, ничему не научился. Грустно, право грустно, да что станешь делать. Такая уж натура. Понимаю, что худо делаю и все-таки делаю, а отчего? От недостатка воли, а может быть и оттого, что разучился заниматься т.е. не не то, чтобы разучился, а и совсем мне научился. как я теперь раскаиваюсь, что не занимался в меньших классах или слишком беспристрастен, или пристрастен. Середины не бывает. Хочу с сегодняшнего дня вставать часов в 6 и заниматься арифметикой, вообще математикой., Сын отечества 1862 г. №1. Января 1го., 
1862-04-09.txt, ﻿9 апреля. Понедельник. Вот прошел и первый день Пасхи. У Заутрени мы были в церкви Мариинской больницы. Мне пришлось стоять между двумя хорошенькими: одна — девица, другая — кажется молоденькая дама. Девица была очень похожа на Блех, только моложе, а потому и лучше. как я посмотрю, какой я дурак 1) оттого, что я нахожусь в таких местах, когда на вещи смотрят иначе, чем смотрели прежде и будут смотреть после. Это бывает со всеми но в такой степени, как у меня и это происходит 2) от того, что я горячее других и в 2) от постоянного отчуждения от женщин. Первого не исправить, второе тоже, третье можно, но не хватает сил, потому что уже поздно за разум. Я недавно думал, каким образом я могу поставить себя в обществе на хорошую ногу, как говорится. Светским человеком не могу быть, и языка французского не знаю, и танцевать хорошо не умею, и не ловок оттого, что никогда не бывал в обществе. Добиваться чего-нибудь чрез всевозможные угождения не совсем люблю, да и слишком горд для этого, потому что конечно худо. Остается одно — быть ученым — и тут тоже не хватает силы, следовательно я никогда не выйду в общество. Впрочем почему знать; зачем заранее петь себе панихиду. Я чувствую что мой выход из гимназии произведет переворот во мне, а следовательно и в моей жизни, потому что, хотя и говорят, что человек зависит от обстоятельств, но более обстоятельства зависят от человека. Будет ли этот переход полезен или вреден, мне нет дела, я знаю, что он будет и от меня зависеть обратить его себе на пользу — и этого с меня довольно. Вчера я был только у Марьи Павловны, Георгиевских да Софьи Константиновны, которая мне подарила 1 рубль серебром деньгами и дюжину голландских платков. Как ни совестно было брать, но взял: делать было нечего. Софья Константиновна до сих пор считает меня за мальчика, что для меня обидно, а впрочем это смешно, что мне за дело, как на меня смотрят другие, впрочем и это глупо, от мнения общества зависеть и положение человека в свете. Все бы мои желания окончились со степенью доктора медицины и хорошенькой и умной и доброй и пр. и пр. женой. Более для меня ничего не нужно. Конечно к этому надо прибавить безбедное состояние, чтобы не мучить жены. Лучше одному страдать, чем замучить вместе с собой другое ни в чем не виновное существо., Сын отечества 1862 г. №1. Января 1го., 
1862-05-03.txt, ﻿3 мая. Четверг. Вчера кончился экзамен математики в 11 ½ часов вечера, а начался в 6 часов. Я экзаменовался ровно в 10 часов при свете лампы. Пошел в гимназию в 4 часа, не пообедав, а есть нисколько не хотелось. Из математики я получил 3. По крайней мере Миквиц так говорит. Он меня порядочно сбивал, ну да не велика беда. Получил 3 и довольно. С чином выйду., Сын отечества 1862 г. №1. Января 1го., 
1862-05-05.txt, ﻿5 мая. Суббота. Вчера я выдержал экзамен из французского языка, хотя не очень хорошо, но тройка будет, следовательно беспокоиться не о чем. Сегодня у нас такая была баталия с Соней, какой еще никогда не бывало. Соня заплакала как то особенно. Я сидел в папином кабинете. Я не знаю, что со мной случилось, когда я услышал этот раздирающий душу крик. Я уже догадался, что происходит. Вскочил, как сумасшедший, руки и ноги задрожали, сам покраснел от того, что кровь бросилась к голове. Волнение было так сильно, что я не мог говорить. Прибежав в комнаты, я счел за долг отпустить маме какую-то дерзость и сам теперь не помню. Маше посулил кулак в зубы и кончилось этим мое заступничество. Я удивляюсь терпенью Сони. Я бы давно уж на ее месте отправился на тот свет. Право, если случится несколько таких историй — я умру, никак не выдержу. Грустно, но что станешь делать., Сын отечества 1862 г. №1. Января 1го., 
1862-06-03.txt, ﻿3 июня. Вторник. Я уже покончил свои дела с гимназией. Остается еще получить на акте аттестат и я расстанусь с ней, быть может на веки. Экзамены все выдержал и хотя получил менее того, что ожидал. но все таки доволен. Чин будет, а более мне ничего и не нужно. Каким т.е. которым я выйду — не знаю. Да ведь медали не дадут. а там каким бы не вышел все равно ничего не прибавят и не убавят. Досадно только становится, когда увидишь что какой-нибудь Дессимо, набитый дурак, получает отметку более, из того предмета в котором решительно ничего не смыслит. Хотел я написать латинскую речь De vita Virgilii, да Лемониус говорит, что у нас речей не будет. Я решился не писать. Теперь мне, как угодно, предлагай, а уже ни за что не напишу. , Сын отечества 1862 г. №1. Января 1го., 
